<?xml version="1.0" encoding="utf-8" ?>
<?xml-stylesheet type="text/xsl" href="channelpresets-stylesheet.xsl"?>
<channelpresetcollection xmlns="http://www.biopac.com/ChannelPresets" xmlns:xsi="http://www.w3.org/2001/XMLSchema-instance"
	xsi:schemaLocation="http://www.biopac.com/ChannelPresets channelpresets-schema.xsd" version="1.0" creator="PresetXMLEditor">
	<analogpresetcollection>
		<analogpreset uid="a1">
			<presetlabel>Accelerometer (5 g's max.)</presetlabel>
			<channellabel>Accelerometer</channellabel>
			<unitslabel>g's</unitslabel>
			<scaling>
				<value unscaled="0.011000000000000" scaled="1.000000000000000" />
				<value unscaled="0.010000000000000" scaled="0.000000000000000" />
			</scaling>
			<hardwareconfig type="35">
				<settings>
					<gain>500</gain>
					<offset>0.0000</offset>
					<inputcoupling>DC</inputcoupling>
					<highpassfilter>0.05</highpassfilter>
				</settings>
				<dspfiltercollection>
					<dspfilter type="LowPass">
						<frequency>66.5000</frequency>
						<q>0.5000</q>
					</dspfilter>
					<dspfilter type="LowPass">
						<frequency>38.5000</frequency>
						<q>1.0000</q>
					</dspfilter>
					<dspfilter type="BandStopLineFrequency">
						<frequency>60.0000</frequency>
						<q>1.0000</q>
					</dspfilter>
				</dspfiltercollection>
			</hardwareconfig>
		</analogpreset>
		<analogpreset uid="a2">
			<presetlabel>Accelerometer (50 g's max.)</presetlabel>
			<channellabel>Accelerometer</channellabel>
			<unitslabel>g's</unitslabel>
			<scaling>
				<value unscaled="0.007500000000000" scaled="10.000000000000000" />
				<value unscaled="0.006500000000000" scaled="0.000000000000000" />
			</scaling>
			<hardwareconfig type="35">
				<settings>
					<gain>500</gain>
					<offset>0.0000</offset>
					<inputcoupling>DC</inputcoupling>
					<highpassfilter>0.05</highpassfilter>
				</settings>
				<dspfiltercollection>
					<dspfilter type="LowPass">
						<frequency>66.5000</frequency>
						<q>0.5000</q>
					</dspfilter>
					<dspfilter type="LowPass">
						<frequency>38.5000</frequency>
						<q>1.0000</q>
					</dspfilter>
					<dspfilter type="BandStopLineFrequency">
						<frequency>60.0000</frequency>
						<q>1.0000</q>
					</dspfilter>
				</dspfiltercollection>
			</hardwareconfig>
		</analogpreset>
		<analogpreset uid="a3">
			<presetlabel>Airflow (SS11LA)</presetlabel>
			<channellabel>Airflow</channellabel>
			<unitslabel>liters/sec</unitslabel>
			<scaling>
				<value unscaled="-0.003000000000000" scaled="-10.000000000000000" />
				<value unscaled="0.003000000000000" scaled="10.000000000000000" />
			</scaling>
			<hardwareconfig type="35">
				<settings>
					<gain>5000</gain>
					<offset>0.0000</offset>
					<inputcoupling>DC</inputcoupling>
					<highpassfilter>0.05</highpassfilter>
				</settings>
				<dspfiltercollection>
					<dspfilter type="LowPass">
						<frequency>66.5000</frequency>
						<q>0.5000</q>
					</dspfilter>
					<dspfilter type="LowPass">
						<frequency>38.5000</frequency>
						<q>1.0000</q>
					</dspfilter>
					<dspfilter type="BandStopLineFrequency">
						<frequency>60.0000</frequency>
						<q>1.0000</q>
					</dspfilter>
				</dspfiltercollection>
			</hardwareconfig>
		</analogpreset>
		<analogpreset uid="a4">
			<presetlabel>Airflow (SS52L)</presetlabel>
			<channellabel>Airflow</channellabel>
			<unitslabel>liters/sec</unitslabel>
			<scaling>
				<value unscaled="0.000000000000000" scaled="0.000000000000000" />
				<value unscaled="0.192500000000000" scaled="1.000000000000000" />
			</scaling>
			<hardwareconfig type="35">
				<settings>
					<gain>1000</gain>
					<offset>0.0000</offset>
					<inputcoupling>DC</inputcoupling>
					<highpassfilter>0.05</highpassfilter>
				</settings>
				<dspfiltercollection>
					<dspfilter type="LowPass">
						<frequency>66.5000</frequency>
						<q>0.5000</q>
					</dspfilter>
					<dspfilter type="LowPass">
						<frequency>38.5000</frequency>
						<q>1.0000</q>
					</dspfilter>
					<dspfilter type="BandStopLineFrequency">
						<frequency>60.0000</frequency>
						<q>1.0000</q>
					</dspfilter>
				</dspfiltercollection>
			</hardwareconfig>
		</analogpreset>
		<analogpreset uid="a5">
			<presetlabel>Blood Pressure Cuff</presetlabel>
			<channellabel>Blood Pressure Cuff</channellabel>
			<unitslabel>mmHg</unitslabel>
			<scaling>
				<value unscaled="0.000000000000000" scaled="0.000000000000000" />
				<value unscaled="0.002500000000000" scaled="100.000000000000000" />
			</scaling>
			<hardwareconfig type="35">
				<settings>
					<gain>500</gain>
					<offset>0.0000</offset>
					<inputcoupling>DC</inputcoupling>
					<highpassfilter>0.05</highpassfilter>
				</settings>
				<dspfiltercollection>
					<dspfilter type="LowPass">
						<frequency>66.5000</frequency>
						<q>0.5000</q>
					</dspfilter>
					<dspfilter type="LowPass">
						<frequency>38.5000</frequency>
						<q>1.0000</q>
					</dspfilter>
					<dspfilter type="BandStopLineFrequency">
						<frequency>60.0000</frequency>
						<q>1.0000</q>
					</dspfilter>
				</dspfiltercollection>
			</hardwareconfig>
		</analogpreset>
		<analogpreset uid="a6">
			<presetlabel>BNC (SS9L, -10 to +10 Volts max.)</presetlabel>
			<channellabel>BNC</channellabel>
			<unitslabel>Volts</unitslabel>
			<scaling>
				<value unscaled="-0.001000000000000" scaled="-1.000000000000000" />
				<value unscaled="0.001000000000000" scaled="1.000000000000000" />
			</scaling>
			<hardwareconfig type="35">
				<settings>
					<gain>1000</gain>
					<offset>0.0000</offset>
					<inputcoupling>DC</inputcoupling>
					<highpassfilter>0.05</highpassfilter>
				</settings>
				<dspfiltercollection>
					<dspfilter type="None">
						<frequency>66.5000</frequency>
						<q>0.5000</q>
					</dspfilter>
					<dspfilter type="None">
						<frequency>38.5000</frequency>
						<q>1.0000</q>
					</dspfilter>
					<dspfilter type="None">
						<frequency>60.0000</frequency>
						<q>5.0000</q>
					</dspfilter>
				</dspfiltercollection>
			</hardwareconfig>
		</analogpreset>
		<analogpreset uid="a7">
			<presetlabel>BNC (SS9L, -50 to +50 Volts max.)</presetlabel>
			<channellabel>BNC</channellabel>
			<unitslabel>Volts</unitslabel>
			<scaling>
				<value unscaled="-0.001000000000000" scaled="-1.000000000000000" />
				<value unscaled="0.001000000000000" scaled="1.000000000000000" />
			</scaling>
			<hardwareconfig type="35">
				<settings>
					<gain>200</gain>
					<offset>0.0000</offset>
					<inputcoupling>DC</inputcoupling>
					<highpassfilter>0.05</highpassfilter>
				</settings>
				<dspfiltercollection>
					<dspfilter type="None">
						<frequency>66.5000</frequency>
						<q>0.5000</q>
					</dspfilter>
					<dspfilter type="None">
						<frequency>38.5000</frequency>
						<q>1.0000</q>
					</dspfilter>
					<dspfilter type="None">
						<frequency>60.0000</frequency>
						<q>5.0000</q>
					</dspfilter>
				</dspfiltercollection>
			</hardwareconfig>
		</analogpreset>
		<analogpreset uid="a8">
			<presetlabel>BNC (SS70L, -10 to +10 Volts max.)</presetlabel>
			<channellabel>BNC</channellabel>
			<unitslabel>Volts</unitslabel>
			<scaling>
				<value unscaled="-1.000000000000000" scaled="-10.000000000000000" />
				<value unscaled="1.000000000000000" scaled="10.000000000000000" />
			</scaling>
			<hardwareconfig type="35">
				<settings>
					<gain>10</gain>
					<offset>0.0000</offset>
					<inputcoupling>DC</inputcoupling>
					<highpassfilter>0.05</highpassfilter>
				</settings>
				<dspfiltercollection>
					<dspfilter type="None">
						<frequency>66.5000</frequency>
						<q>0.5000</q>
					</dspfilter>
					<dspfilter type="None">
						<frequency>38.5000</frequency>
						<q>1.0000</q>
					</dspfilter>
					<dspfilter type="None">
						<frequency>60.0000</frequency>
						<q>5.0000</q>
					</dspfilter>
				</dspfiltercollection>
			</hardwareconfig>
		</analogpreset>
		<analogpreset uid="a9">
			<presetlabel>Cardiac Output - Z</presetlabel>
			<channellabel>Cardiac Output - Z</channellabel>
			<unitslabel>Ohms</unitslabel>
			<scaling>
				<value unscaled="0.000000000000000" scaled="0.000000000000000" />
				<value unscaled="0.050000000000000" scaled="100.000000000000000" />
			</scaling>
			<hardwareconfig type="35">
				<settings>
					<gain>200</gain>
					<offset>0.0000</offset>
					<inputcoupling>DC</inputcoupling>
					<highpassfilter>0.5</highpassfilter>
				</settings>
				<dspfiltercollection>
					<dspfilter type="LowPass">
						<frequency>66.5000</frequency>
						<q>0.5000</q>
					</dspfilter>
					<dspfilter type="LowPass">
						<frequency>38.5000</frequency>
						<q>1.0000</q>
					</dspfilter>
					<dspfilter type="BandStopLineFrequency">
						<frequency>60.0000</frequency>
						<q>1.0000</q>
					</dspfilter>
				</dspfiltercollection>
			</hardwareconfig>
		</analogpreset>
		<analogpreset uid="a10">
			<presetlabel>Cardiac Output - dZ/dt</presetlabel>
			<channellabel>Cardiac Output - dZ/dt</channellabel>
			<unitslabel>Ohms/sec</unitslabel>
			<scaling>
				<value unscaled="0.000000000000000" scaled="0.000000000000000" />
				<value unscaled="0.005000000000000" scaled="2.000000000000000" />
			</scaling>
			<hardwareconfig type="35">
				<settings>
					<gain>200</gain>
					<offset>0.0000</offset>
					<inputcoupling>DC</inputcoupling>
					<highpassfilter>0.5</highpassfilter>
				</settings>
				<dspfiltercollection>
					<dspfilter type="LowPass">
						<frequency>66.5000</frequency>
						<q>0.5000</q>
					</dspfilter>
					<dspfilter type="LowPass">
						<frequency>38.5000</frequency>
						<q>1.0000</q>
					</dspfilter>
					<dspfilter type="BandStopLineFrequency">
						<frequency>60.0000</frequency>
						<q>1.0000</q>
					</dspfilter>
				</dspfiltercollection>
			</hardwareconfig>
		</analogpreset>
		<analogpreset uid="a11">
			<presetlabel>Clench Force (kg)</presetlabel>
			<channellabel>Clench Force</channellabel>
			<unitslabel>kg</unitslabel>
			<scaling>